Title,Likes,Comments
En la Arena CDMX la gente se llevó una sorpresa al ver que en la pelea preliminar y estelar de la UFC Fight Night en la,23,0
Reportan robos en fraccionamiento Domingo Arrieta; vecinos creen que es una misma persona,39,1
Los riesgos que se llegan a correr cuando se revela información personal de los periodistas en México,13,5
"Filtran en redes teléfono de José Ramón López Beltrán, hijo mayor de AMLO",63,40
"Desde el 2010, El Siglo organiza el concurso LEEMOS en compañía de docentes y entidades educativas, con el fin de",6,0
Vehículo se impacta contra patrulla de Policía Municipal en avenida Fidel Velázquez,102,4
Trabajos de excavación provocan fuga de gas en Ciudad Industrial,41,0
Investigarán fuga de información sobre retenes antialcohol en Seguridad Pública Municipal,87,12
Fallecen dos mujeres en choque frontal en carretera Durango-Gómez Palacio,74,2
📰 #Las5DeLaSemana con Fernanda Calderón,6,0
"#PostalDelSiglo | La luna llena, ""Luna de Nieve"", se despide del cielo de Durango; esta noche se encuentra al 99.8%",25,1
"Los murales en Durango cada vez van siendo más y el pintor duranguense, Franky Bañales, platicó con nosotros sobre este",93,2
Despliegan operativo en la Sierra de Pueblo Nuevo tras enfrentamientos de grupos armados Nota: https://elsiglo,88,0
Menos de 20% de los vehículos que circulan en Durango lo hacen con un seguro #Durango #segurodeauto #vialidad,49,1
Localizan sin vida a joven mujer en el fraccionamiento Aranjuez,80,0
CORTE INFORMATIVO 23/02/2024 #Noticiasstv #Noticias #NoticiasHoy #Durango,2,0
AMLO desestima dar a conocer información de periodista de NYT,65,29
Cámaras captan robo en local comercial en Centro Histórico,90,0
"Durante años, EUA investigó nexos entre cárteles y aliados de AMLO: The New York Times",37,8
"Muchas personas no pueden vivir sin una taza de café al día, es por ello que, a través de la cultura y el folklore",118,8
"Es oficial: Adiós a Generales de la LMB, pero…",76,0
CORTE INFORMATIVO 22/02/2024 #Noticiasstv #Noticias #NoticiasHoy #Durango,3,0
Niño de 7 años muere en Lerdo tras ser arrollado por una ambulancia en Nazas,26,0
Sheinbaum responde con emoji a publicación de Fox en contra de ella,79,18
